{
  "$schema": "../formats/apex-track-source.v2.schema.json",
  "format": "apex-track-source",
  "formatVersion": 2,
  "savedAtIso": "2026-08-02T21:01:13.514Z",
  "track": {
    "number": 6,
    "id": "circuito-vector-evolucion",
    "name": "Circuito Vector Evolución",
    "version": "1.0.0"
  },
  "assets": {
    "visual": {
      "format": "procedural",
      "generator": "circuito-vector-evolucion-v1.0.0-adaptive-floor-loop",
      "uri": null
    },
    "collision": {
      "format": "generated",
      "uri": null
    }
  },
  "configuration": {
    "profile": "apex-drive",
    "profileVersion": 1,
    "coordinateSystem": {
      "unit": "meter",
      "upAxis": "Y",
      "handedness": "right"
    },
    "start": {
      "position": {
        "x": 58.020332093625576,
        "y": 1.101611920796685,
        "z": -183.97991060888614
      },
      "yawRadians": 2.8863576559540727
    },
    "presentation": {
      "garage": false,
      "startLine": false
    },
    "geometry": {
      "roadWidthM": 18,
      "shoulderWidthM": 8,
      "groundHeightM": 0,
      "roadThicknessM": 0.08,
      "boundaryMode": "guardrails",
      "roadsideMode": "adaptive-terrain"
    },
    "timing": {
      "startRadiusM": 8,
      "checkpointRadiusM": 12,
      "checkpointIntervalPoints": 14,
      "ignoredTailPoints": 5,
      "sectorCount": 6,
      "storageKey": "apex-drive.circuito-vector-evolucion.lap-timing.v1"
    },
    "surfaces": {
      "road": "asphalt",
      "shoulder": "grass",
      "ground": "grass"
    }
  },
  "primaryRouteId": "main-route",
  "segments": [
    {
      "id": "main",
      "name": "Trazado principal",
      "kind": "road",
      "enabled": true,
      "editor": {
        "closed": true,
        "controlSpacingM": 10,
        "collisionSpacingM": 2,
        "simplificationToleranceM": 0.12
      },
      "geometry": {
        "roadWidthM": 18,
        "laneCount": 1,
        "surface": "asphalt",
        "boundaryMode": "guardrails",
        "roadsideMode": "adaptive-terrain",
        "visualMode": "inherit"
      },
      "controlPoints": [
        {
          "x": 58.020332093625576,
          "y": 1.101611920796685,
          "z": -183.97991060888614,
          "bankRadians": 0,
          "surface": "asphalt"
        },
        {
          "x": 116.77920835200607,
          "y": 1.2219880976070558,
          "z": -391.4334851191187,
          "bankRadians": 0.05948186722609598,
          "surface": "asphalt"
        },
        {
          "x": 141.0432569870696,
          "y": 1.3255384586555619,
          "z": -494.7655660289601,
          "bankRadians": 0.06494587716425737,
          "surface": "asphalt"
        },
        {
          "x": 169.41763636664314,
          "y": 1.4552752261266382,
          "z": -582.8333118715639,
          "bankRadians": 0.051726559897773985,
          "surface": "asphalt"
        },
        {
          "x": 208.77358539864306,
          "y": 1.6096447318434575,
          "z": -649.3020432315204,
          "bankRadians": 0.061324548744651125,
          "surface": "asphalt"
        },
        {
          "x": 243.1915400115073,
          "y": 1.7873528359809296,
          "z": -693.3859061557467,
          "bankRadians": 0.0709220145420903,
          "surface": "asphalt"
        },
        {
          "x": 265.27579753516255,
          "y": 2.034011149215144,
          "z": -718.8587436329217,
          "bankRadians": 0.08051881625483523,
          "surface": "asphalt"
        },
        {
          "x": 281.3448901855536,
          "y": 2.4083210680515683,
          "z": -729.5990507635977,
          "bankRadians": 0.09011502635714533,
          "surface": "asphalt"
        },
        {
          "x": 294.22089458573987,
          "y": 2.765983855192575,
          "z": -724.3902088383327,
          "bankRadians": 0.10930700591516133,
          "surface": "asphalt"
        },
        {
          "x": 295.7975747805333,
          "y": 3.237152398607307,
          "z": -706.3705136517847,
          "bankRadians": 0.11877102554122512,
          "surface": "asphalt"
        },
        {
          "x": 277.5061483709627,
          "y": 4.0526229905796445,
          "z": -676.0072411827043,
          "bankRadians": 0.12213326293915064,
          "surface": "asphalt"
        },
        {
          "x": 239.86800911849616,
          "y": 5.159480530816129,
          "z": -636.1485074452211,
          "bankRadians": 0.043741079223398,
          "surface": "asphalt"
        },
        {
          "x": 211.3432970058871,
          "y": 6.054528823002073,
          "z": -599.277212231639,
          "bankRadians": -0.041419694225191,
          "surface": "asphalt"
        },
        {
          "x": 194.8746589274566,
          "y": 6.604835646515867,
          "z": -569.0758693063751,
          "bankRadians": -0.051017466967340094,
          "surface": "asphalt"
        },
        {
          "x": 185.50458806323343,
          "y": 6.873716422821789,
          "z": -540.2718688416788,
          "bankRadians": -0.06061651924333017,
          "surface": "asphalt"
        },
        {
          "x": 182.76649563446188,
          "y": 6.838085936643391,
          "z": -507.40927802414257,
          "bankRadians": -0.07021573717387823,
          "surface": "asphalt"
        },
        {
          "x": 186.96037213821774,
          "y": 6.455322358181321,
          "z": -464.6510120796206,
          "bankRadians": -0.07981477048811035,
          "surface": "asphalt"
        },
        {
          "x": 197.3445252125541,
          "y": 5.753693510488784,
          "z": -408.3822583784392,
          "bankRadians": -0.08941356025448641,
          "surface": "asphalt"
        },
        {
          "x": 224.1930581329657,
          "y": 4.090845360883012,
          "z": -276.2770569469518,
          "bankRadians": 0.06777583082179778,
          "surface": "asphalt"
        },
        {
          "x": 233.167807636089,
          "y": 3.5330030539714383,
          "z": -219.49093224337258,
          "bankRadians": 0.07917823068893676,
          "surface": "asphalt"
        },
        {
          "x": 236.6543675205719,
          "y": 3.258508521060318,
          "z": -175.44704752921533,
          "bankRadians": 0.08123174759684365,
          "surface": "asphalt"
        },
        {
          "x": 234.58639690714892,
          "y": 3.2252217440129765,
          "z": -143.4364303157247,
          "bankRadians": 0.08927651210531275,
          "surface": "asphalt"
        },
        {
          "x": 227.41692302102504,
          "y": 3.3632403031402665,
          "z": -120.93040953334702,
          "bankRadians": 0.09886980911672559,
          "surface": "asphalt"
        },
        {
          "x": 215.3659741142957,
          "y": 3.6066112422556054,
          "z": -104.4694154527149,
          "bankRadians": 0.10752477095452281,
          "surface": "asphalt"
        },
        {
          "x": 197.6156237455602,
          "y": 3.906377905289358,
          "z": -89.64190378013515,
          "bankRadians": 0.10352155438452801,
          "surface": "asphalt"
        },
        {
          "x": 176.8178124257335,
          "y": 4.172280564279512,
          "z": -74.20319957031485,
          "bankRadians": 0.036333238763869645,
          "surface": "asphalt"
        },
        {
          "x": 161.49451490625302,
          "y": 4.256670326919532,
          "z": -60.0640282835591,
          "bankRadians": 0.02673398893905765,
          "surface": "asphalt"
        },
        {
          "x": 151.8566064911925,
          "y": 4.11321617801943,
          "z": -43.62972047278572,
          "bankRadians": 0.017134968321552514,
          "surface": "asphalt"
        },
        {
          "x": 143.72050312095703,
          "y": 3.6765522798558523,
          "z": -16.473773276023245,
          "bankRadians": 0.007536428681524467,
          "surface": "asphalt"
        },
        {
          "x": 134.0088026633337,
          "y": 2.9776795475196804,
          "z": 20.801143698499686,
          "bankRadians": 0.06849217231979049,
          "surface": "asphalt"
        },
        {
          "x": 118.05447810582136,
          "y": 2.290708761511498,
          "z": 50.65782333289083,
          "bankRadians": 0.07809041682857937,
          "surface": "asphalt"
        },
        {
          "x": 93.04041446655779,
          "y": 1.7349386142793184,
          "z": 64.98202604490083,
          "bankRadians": 0.10394257297248638,
          "surface": "asphalt"
        },
        {
          "x": 69.5619607124811,
          "y": 1.4343272430136664,
          "z": 62.89727780185668,
          "bankRadians": 0.07514536265615808,
          "surface": "asphalt"
        },
        {
          "x": 50.878423065335085,
          "y": 1.298448687084675,
          "z": 50.29572093035566,
          "bankRadians": 0.05680520338153788,
          "surface": "asphalt"
        },
        {
          "x": 36.62089721789609,
          "y": 1.2083641211030365,
          "z": 30.957350839576574,
          "bankRadians": 0.04720610861633533,
          "surface": "asphalt"
        },
        {
          "x": 28.82305611108896,
          "y": 1.1416871934166326,
          "z": 2.6564465042426963,
          "bankRadians": 0.03760701404651033,
          "surface": "asphalt"
        },
        {
          "x": 29.302498438679983,
          "y": 1.1007555539776823,
          "z": -39.7794336835433,
          "bankRadians": 0.02800791962727948,
          "surface": "asphalt"
        },
        {
          "x": 38.94169948778584,
          "y": 1.0867923704714302,
          "z": -101.3918882566282,
          "bankRadians": 0.018408825329437918,
          "surface": "asphalt"
        }
      ],
      "evaluatedPoints": [
        {
          "x": 58.020332093625576,
          "y": 1.101611920796685,
          "z": -183.97991060888614,
          "bankRadians": 0,
          "surface": "asphalt"
        },
        {